{
  "schema_version": "1.0.0",
  "generator": "codeanalyzer-iac",
  "marker_labels": [],
  "node_labels": [
    {"label": "Application", "merge_label": "Application", "key": "id", "properties": {"id": "string"}},
    {"label": "IaCApplication", "merge_label": "Application", "key": "id", "properties": {"id": "string"}},
    {"label": "Artifact", "merge_label": "Artifact", "key": "id", "properties": {"id": "string"}},
    {"label": "IaCArtifact", "merge_label": "Artifact", "key": "id", "properties": {"id": "string"}},
    {"label": "HelmArtifact", "merge_label": "Artifact", "key": "id", "properties": {"id": "string"}},
    {"label": "HelmChart", "merge_label": "Artifact", "key": "id", "properties": {"id": "string"}},
    {"label": "HelmRequirements", "merge_label": "Artifact", "key": "id", "properties": {"id": "string"}},
    {"label": "HelmLock", "merge_label": "Artifact", "key": "id", "properties": {"id": "string"}},
    {"label": "HelmValues", "merge_label": "Artifact", "key": "id", "properties": {"id": "string"}},
    {"label": "HelmValuesSchema", "merge_label": "Artifact", "key": "id", "properties": {"id": "string"}},
    {"label": "HelmTemplate", "merge_label": "Artifact", "key": "id", "properties": {"id": "string"}},
    {"label": "HelmCRD", "merge_label": "Artifact", "key": "id", "properties": {"id": "string"}},
    {"label": "HelmIgnore", "merge_label": "Artifact", "key": "id", "properties": {"id": "string"}},
    {"label": "ConfigKey", "merge_label": "ConfigKey", "key": "id", "properties": {"id": "string"}},
    {"label": "IaCValue", "merge_label": "ConfigKey", "key": "id", "properties": {"id": "string"}},
    {"label": "HelmValue", "merge_label": "ConfigKey", "key": "id", "properties": {"id": "string"}},
    {"label": "CodeAnalyzerIaCConfig", "merge_label": "Artifact", "key": "id", "properties": {"id": "string"}},
    {"label": "HelmDependency", "merge_label": "HelmDependency", "key": "id", "properties": {"id": "string"}},
    {"label": "HelmChartReference", "merge_label": "HelmChartReference", "key": "id", "properties": {"id": "string"}},
    {"label": "HelmNamedTemplate", "merge_label": "HelmNamedTemplate", "key": "id", "properties": {"id": "string"}},
    {"label": "HelmTemplateCall", "merge_label": "HelmTemplateCall", "key": "id", "properties": {"id": "string"}},
    {"label": "HelmValueReference", "merge_label": "HelmValueReference", "key": "id", "properties": {"id": "string"}},
    {"label": "HelmResourceTemplate", "merge_label": "HelmResourceTemplate", "key": "id", "properties": {"id": "string"}},
    {"label": "HelmLookupReference", "merge_label": "HelmLookupReference", "key": "id", "properties": {"id": "string"}},
    {"label": "HelmRenderProfile", "merge_label": "HelmRenderProfile", "key": "id", "properties": {"id": "string", "origin": "string"}},
    {"label": "HelmValueLayer", "merge_label": "HelmValueLayer", "key": "id", "properties": {"id": "string", "ordinal": "integer", "source_id": "string"}},
    {"label": "HelmRender", "merge_label": "HelmRender", "key": "id", "properties": {"id": "string", "status": "string", "profile_id": "string", "value_layer_ids": "string[]", "effective_values_sha256": "string"}},
    {"label": "IaCDiagnostic", "merge_label": "IaCDiagnostic", "key": "id", "properties": {"id": "string", "severity": "string", "code": "string", "message": "string"}},
    {"label": "HelmDiagnostic", "merge_label": "IaCDiagnostic", "key": "id", "properties": {"id": "string", "severity": "string", "code": "string", "message": "string"}},
    {"label": "KubernetesResource", "merge_label": "KubernetesResource", "key": "id", "properties": {"id": "string", "api_version": "string", "resource_kind": "string", "manifest_sha256": "string", "render_id": "string", "origin_ids": "string[]"}},
    {"label": "KubernetesResourceAddress", "merge_label": "KubernetesResourceAddress", "key": "id", "properties": {"id": "string", "group": "string", "resource_kind": "string", "namespace": "string", "name": "string"}},
    {"label": "IdentityAlias", "merge_label": "IdentityAlias", "key": "id", "properties": {"id": "string", "target": "string"}},
    {"label": "IaCAlias", "merge_label": "IdentityAlias", "key": "id", "properties": {"id": "string", "target": "string"}},
    {"label": "Package", "merge_label": "Package", "key": "id", "properties": {"id": "string", "purl": "string"}}
  ],
  "relationship_types": [
    {"type": "HAS_ARTIFACT", "from": ["IaCApplication"], "to": ["Artifact"], "properties": {}},
    {"type": "DEFINES_CONFIG", "from": ["Artifact"], "to": ["ConfigKey"], "properties": {}},
    {"type": "IAC_PART_OF_CHART", "from": ["HelmArtifact"], "to": ["HelmChart"], "properties": {}},
    {"type": "IAC_DECLARES_DEPENDENCY", "from": ["HelmChart"], "to": ["HelmDependency"], "properties": {}},
    {"type": "IAC_TARGETS_CHART_REFERENCE", "from": ["HelmDependency"], "to": ["HelmChartReference"], "properties": {}},
    {"type": "IAC_RESOLVES_TO_CHART", "from": ["HelmChartReference"], "to": ["HelmChart"], "properties": {}},
    {"type": "IAC_IDENTIFIED_BY_PACKAGE", "from": ["HelmChartReference"], "to": ["Package"], "properties": {}},
    {"type": "IAC_DEFINES_TEMPLATE", "from": ["HelmTemplate"], "to": ["HelmNamedTemplate"], "properties": {}},
    {"type": "IAC_HAS_TEMPLATE_CALL", "from": ["HelmTemplate"], "to": ["HelmTemplateCall"], "properties": {}},
    {"type": "IAC_CALLS_TEMPLATE", "from": ["HelmTemplateCall"], "to": ["HelmNamedTemplate"], "properties": {}},
    {"type": "IAC_HAS_VALUE_REFERENCE", "from": ["HelmTemplate"], "to": ["HelmValueReference"], "properties": {}},
    {"type": "IAC_REFERENCES_VALUE", "from": ["HelmValueReference"], "to": ["HelmValue"], "properties": {}},
    {"type": "IAC_DECLARES_PROFILE", "from": ["CodeAnalyzerIaCConfig", "HelmChart"], "to": ["HelmRenderProfile"], "properties": {}},
    {"type": "IAC_RENDERS_CHART", "from": ["HelmRenderProfile"], "to": ["HelmChart"], "properties": {}},
    {"type": "IAC_HAS_VALUE_LAYER", "from": ["HelmRenderProfile"], "to": ["HelmValueLayer"], "properties": {}},
    {"type": "IAC_READS_FROM", "from": ["HelmValueLayer"], "to": ["Artifact", "ConfigKey"], "properties": {}},
    {"type": "IAC_HAS_RENDER", "from": ["HelmChart"], "to": ["HelmRender"], "properties": {}},
    {"type": "IAC_CONFIGURED_BY", "from": ["HelmRender"], "to": ["HelmRenderProfile"], "properties": {}},
    {"type": "IAC_HAS_DIAGNOSTIC", "from": ["Artifact", "HelmRender"], "to": ["HelmDiagnostic"], "properties": {}},
    {"type": "IAC_PRODUCES", "from": ["HelmRender"], "to": ["KubernetesResource"], "properties": {}},
    {"type": "IAC_TARGETS_RESOURCE", "from": ["KubernetesResource"], "to": ["KubernetesResourceAddress"], "properties": {}},
    {"type": "IAC_DERIVED_FROM", "from": ["KubernetesResource"], "to": ["HelmResourceTemplate"], "properties": {}},
    {"type": "IAC_ALIAS_OF", "from": ["IaCAlias"], "to": ["Artifact", "KubernetesResourceAddress"], "properties": {}}
  ],
  "constraints": [
    "CREATE CONSTRAINT application_id IF NOT EXISTS FOR (n:Application) REQUIRE n.id IS UNIQUE",
    "CREATE CONSTRAINT artifact_id IF NOT EXISTS FOR (n:Artifact) REQUIRE n.id IS UNIQUE",
    "CREATE CONSTRAINT config_key_id IF NOT EXISTS FOR (n:ConfigKey) REQUIRE n.id IS UNIQUE",
    "CREATE CONSTRAINT helm_dependency_id IF NOT EXISTS FOR (n:HelmDependency) REQUIRE n.id IS UNIQUE",
    "CREATE CONSTRAINT helm_chart_reference_id IF NOT EXISTS FOR (n:HelmChartReference) REQUIRE n.id IS UNIQUE",
    "CREATE CONSTRAINT helm_named_template_id IF NOT EXISTS FOR (n:HelmNamedTemplate) REQUIRE n.id IS UNIQUE",
    "CREATE CONSTRAINT helm_template_call_id IF NOT EXISTS FOR (n:HelmTemplateCall) REQUIRE n.id IS UNIQUE",
    "CREATE CONSTRAINT helm_value_reference_id IF NOT EXISTS FOR (n:HelmValueReference) REQUIRE n.id IS UNIQUE",
    "CREATE CONSTRAINT helm_resource_template_id IF NOT EXISTS FOR (n:HelmResourceTemplate) REQUIRE n.id IS UNIQUE",
    "CREATE CONSTRAINT helm_lookup_reference_id IF NOT EXISTS FOR (n:HelmLookupReference) REQUIRE n.id IS UNIQUE",
    "CREATE CONSTRAINT helm_render_profile_id IF NOT EXISTS FOR (n:HelmRenderProfile) REQUIRE n.id IS UNIQUE",
    "CREATE CONSTRAINT helm_value_layer_id IF NOT EXISTS FOR (n:HelmValueLayer) REQUIRE n.id IS UNIQUE",
    "CREATE CONSTRAINT helm_render_id IF NOT EXISTS FOR (n:HelmRender) REQUIRE n.id IS UNIQUE",
    "CREATE CONSTRAINT iac_diagnostic_id IF NOT EXISTS FOR (n:IaCDiagnostic) REQUIRE n.id IS UNIQUE",
    "CREATE CONSTRAINT kubernetes_resource_id IF NOT EXISTS FOR (n:KubernetesResource) REQUIRE n.id IS UNIQUE",
    "CREATE CONSTRAINT kubernetes_resource_address_id IF NOT EXISTS FOR (n:KubernetesResourceAddress) REQUIRE n.id IS UNIQUE",
    "CREATE CONSTRAINT identity_alias_id IF NOT EXISTS FOR (n:IdentityAlias) REQUIRE n.id IS UNIQUE",
    "CREATE CONSTRAINT package_id IF NOT EXISTS FOR (n:Package) REQUIRE n.id IS UNIQUE"
  ],
  "indexes": []
}
